{
  "app": {
    "slug": "",
    "name": "",
    "url": "",
    "repo": "",
    "local_path": ""
  },
  "version": "0.1.0",
  "updated_at": "",
  "active_feature": null,
  "deployed_features": [],
  "queued_features": [],
  "metrics": {
    "features_total": 0,
    "features_deployed": 0,
    "tasks_total": 0,
    "tasks_completed": 0,
    "avg_ux_score": null,
    "total_rework_count": 0,
    "total_duration_sec": null
  }
}
